{
  "slug": "test-security",
  "name": "Test Security",
  "description": "A test company entry to verify the automated listing and deployment pipeline end to end.",
  "website": "https://example.com",
  "services": ["opsec", "web2-security"],
  "tags": ["opsec", "web3"],
  "endorsed": false,
  "github": null,
  "twitter": null,
  "open_source_repos": []
}
